0,1,2,3
KnitxCode: Exploring a Craftsmanship-driven Approach to Computational Thinking,"S\o{}rensen, Marie-Louise Stisen Kjerstein and Fog, Bjarke Vognstrup and Musaeus, Line Have and Petersen, Marianne Graves",2022,"In recent years, computational thinking (CT) has focused on how children and citizens develop basic computing skills which empower them to participate in a digitised society and broaden participation and engagement with CT. We present the exploration of a craftsmanship-driven approach to engage people in CT. To explore this approach a team of knitters, a computer scientist and a computing education expert iteratively designed the KnitxCode workshop. KnitxCode utilises knitting in combination with CT concepts as the foundation for the activities. The workshop was evaluated by 12 participants with no programming experience and with knitting experience ranging from 2-25 years (M = 6). From the evaluation we found that the craftsmanship-driven approach seemed to provide the participants with confidence to learning CT, as shared concepts and practices between knitting and computing supported transitioning from knitting craftsmanship to computing and in this way served to demystify computing."
Learning Computational Thinking Efficiently: How Parsons Programming Puzzles within Scratch Might Help,"Bender, Jeff and Zhao, Bingpu and Dziena, Alex and Kaiser, Gail",2022,"Using a design thinking approach, we surveyed and interviewed grade 6-9 teachers on their experience with Scratch and Parsons Programming Puzzles (PPP). The results lead us to extend Scratch with gameful PPP functionality focused on individual computational thinking (CT) concepts. In this paper, we vary elements of PPPs presented to 624 adult learners to identify those yielding manageable cognitive load (CL), and maximum CT motivation and learning efficiency, for a general populace. Findings indicate PPPs with feedback and without distractors limit CL, those with feedback produce highest CT motivation, and those with an isolated block palette and without distractors produce highest CT learning efficiency. We analyze study data across nine conditions to offer insight to those developing PPP systems with the aim to advance equitable CT education for all."
Modeling of the System for Computational Thinking Automatic Assessment,"Masiulionyte-Dagiene, Vaida",2023,"The aim of the doctoral thesis is to model an automated computational thinking (CT) assessment system based on solving processes of the interactive tasks. Currently, a literature review and analysis has been carried out, which has shown that among current CT assessment tools most popular ones still remain different types of tests. A study, comparing the two computational thinking assessment tests has been conducted and it has been observed that using only the tests causes data loss as tests do not collect information on the solution processes. An experiment was carried out to collect and analyze action information while solving the task and using this data to extract the possible different solution methods of an interactive task."
Multiple Programming Languages for Improving Computational Thinking in CS1,"Lee, Dongeun and Hu, Kaoning and El Ariss, Omar and Kwon, Kibum",2023,"Computational thinking can be deemed as thinking in algorithmic way, with which one can transpose given problems into computer algorithms. Since computational thinking requires abstract reasoning, it should not depend on particular programming languages. Unfortunately, introductory programming courses (CS1) often give students false impression that their goals are to teach a particular programming language. This study shares the design of new pedagogy for CS1 that removes dependency on a particular language and promotes computational thinking by teaching multiple programming languages simultaneously. Specifically, chosen programming languages range from low-level to high-level to expose students to different levels of abstraction from the details of computer architecture. Initial student survey responses from both trial and control groups show that there are significant improvements for the trial groups."
Observing Computational Thinking Skills of Kindergarten Children,"Meyer-Baron, Larissa and Stieger, Ramona and Waldvogel, Bettina and Schumann, Nicole and Ruedisueli, Cornelia and Mayr, Franziska",2022,"Computational Thinking skills along with reading, writing, and calculating skills are basic skills for children’s future. Computational Thinking has much in common with problem-solving and creative thinking in general. With regard to Karl Popper ""all life is problem-solving"" [26], this contribution focuses on the common features of problem-solving and unplugged Computational Thinking, by using a special set of Computational Thinking tasks (INGA-Box). Choosing a mix of deductive and inductive approach, a classification scheme for observing the development of Computational Thinking in kindergarten was developed and evaluated with first datasets."
On Teaching Novices Computational Thinking by Utilizing Large Language Models Within Assessments,"Hassan, Mohammed and Chen, Yuxuan and Denny, Paul and Zilles, Craig",2025,"Novice programmers often struggle to develop computational thinking (CT) skills in introductory programming courses. This study investigates the use of Large Language Models (LLMs) to provide scalable, strategy-driven feedback to teach CT. Through think-aloud interviews with 17 students solving code comprehension and writing tasks, we found that LLMs effectively guided decomposition and program development tool usage. Challenges included students seeking direct answers or pasting feedback without considering suggested strategies. We discuss how instructors should integrate LLMs into assessments to support students' learning of CT."
OntoCnE &amp; Neuroeducation Guidelines: An approach to developing Computational Thinking,"Ara\'{u}jo, Cristiana and Henriques, Pedro Rangel and Cerqueira, Jo\~{a}o Jos\'{e}",2025,"Computer Programming (CP) is difficult to teach and learn. Many students who enroll in CP courses have difficulty learning to program, as they have deficits in problem-solving skills and are unable to understand abstract programming concepts. Some studies also state that teaching methods are often not the most appropriate as they are not personalized to each student’s needs and do not complement their learning styles. We believe that Computational Thinking (CT) can help alleviate the difficulties in learning to program, especially if it is developed from an early age. However, it is also crucial that teachers use effective methods to help their students develop CT skills. There are several Learning Resources (LR) (digital or paper format) to develop CT skills, however, we argue that Neuroeducation can contribute to improving the effectiveness of these LR in the teaching and learning process. The evidence about the brain’s learning process can be transformed into principles applicable in Education (Neuroeducation). To understand how we could train CT at various levels of education we built an ontology, OntoCnE, that describes the CT and CP domains. OntoCnE is composed of 3 layers that define: how to develop CT; which concepts should be taught at each level of education; and appropriate training materials. This paper aims to present a CT development approach based on this ontology together with Neuroeducation guidelines. The result of our research is the fourth layer for OntoCnE, which defines the Neuroeducation guidelines to characterize the materials. To illustrate our proposal, we will use LR PathIt as a case study. This approach can contribute to innovative and more efficient training of CT."
Professional Development in Computational Thinking: A Systematic Literature Review,"Espinal, Alejandro and Vieira, Camilo and Magana, Alejandra J.",2024,"This paper presents a systematic literature review of professional development programs in computational thinking (CT). CT has emerged as an essential set of skills that everyone should develop to participate in a global society. However, there were no pre-service or in-service teacher programs to integrate CT into the K–12 classrooms until very recently. Thus, it is important to identify how educators and researchers address the challenges to prepare the next generation of students and what gaps persist in the current literature. We review existing work in this field from two perspectives: First, we analyze the learning outcomes, assessment methods, pedagogical approaches, and pedagogical tools used in the professional development programs in CT. Second, we examine how these programs assess the teachers’ knowledge and skills as outcomes. We used the technological pedagogical and content knowledge (TPACK) framework to characterize existing literature and identify possible gaps in the preparation of pre-service and in-service teachers in CT. Our results suggest that (1) existing evidence is limited to developed countries; (2) many studies are only focusing on teachers understanding the concepts but do not explore how the participants evaluate or create learning activities; (3) no studies look into classroom observations as part of the program, which limits our understanding to how these programs work; and (4) most programs use block-based programming languages as the tool to develop student CT. While block-based programming languages are used for introductory training programs, students are often expected to transfer their learning to more professional programming languages."
Promoting Computational Thinking in Elementary School: A Narrative-Centered Learning Approach,"Boulden, Danielle and Smith, Andy and Cully, Kimkinyona and Houchins, Jennifer and Elsayed, Rasha and Hubbard Cheuoua, Aleata and Minogue, James and Oliver, Kevin and Ringstaff, Cathy and Mott, Bradford",2021,"One of the most efficient ways for elementary school students to gain exposure to computational thinking is when it is integrated into other disciplinary areas; however, elementary school teachers often lack the necessary resources to do this effectively. By leveraging the motivation force of narrative to engage students and the scaffolding affordances of block-based programming to support students, computationally-rich narrative-centered learning offers promise to address this need. In this work, we review design principles from prior work for engaging elementary students in computational thinking as well as results from initial pilot studies to investigate how computationally-rich narrative-centered learning in the context of science problem solving can support the integration of computational thinking into other disciplinary areas."
Resources for Computational Thinking: Co-designing with Teachers,"Mills, Kelly and Angevine, Colin and Weisgrau, Josh",2020,"Computational thinking (CT) has become a recent policy agenda in order for students to develop interest and foundational understanding in computing and preparation for an increasingly technological workforce. In order to integrate CT into K-12 education, teachers need professional support. The field has faced common challenges developing professional learning experiences and resources that facilitate the integration of computational thinking in authentic, equitable and sustainable ways. We have worked with a cohort of over eighty teachers from around the United States to co-design and pilot pedagogical resources for computational thinking. In this poster, we summarize our co-design process with teachers and share the resources we developed for computational thinking integration."
Scaling Up Collaborative Dialogue Analysis: An AI-driven Approach to Understanding Dialogue Patterns in Computational Thinking Education,"Yin, Stella Xin and Liu, Zhengyuan and Goh, Dion Hoe-Lian and Quek, Choon Lang and Chen, Nancy F.",2025,"Pair programming is a collaborative activity that enhances students’ computational thinking (CT) skills. Analyzing students’ interactions during pair programming provides valuable insights into effective learning. However, interpreting classroom dialogues is a challenging and complex task. Due to the simultaneous interaction between interlocutors and other ambient noise in collaborative learning contexts, previous work heavily relied on manual transcription and coding, which is labor-intensive and time-consuming. Recent advancements in speech and language processing offer promising opportunities to automate and scale up dialogue analysis. Besides, previous work mainly focused on task-related interactions, with little attention to social interactions. To address these gaps, we conducted a four-week CT course with 26 fifth-grade primary school students. We recorded their discussions, transcribed them with speech processing models, and developed a coding scheme and applied LLMs for annotation. Our AI-driven pipeline effectively analyzed classroom recordings with high accuracy and efficiency. After identifying the dialogue patterns, we investigated the relationships between these patterns and CT performance. Four clusters of dialogue patterns have been identified: Inquiry, Constructive Collaboration, Disengagement, and Disputation. We observed that Inquiry and Constructive Collaboration patterns were positively related to students’ CT skills, while Disengagement and Disputation patterns were associated with lower CT performance. This study contributes to the understanding of how dialogue patterns relate to CT performance and provides implications for both research and educational practice in CT learning."
Strengthening Computational Thinking within Upper Elementary Classrooms: A Strategy for Broadening Participation in Computer Science,"Sayler, Ben and Anderson, Ann and Caffee, Hannah and Carroll, Becky and Hammel, Koreen and Her Many Horses, Ian and Kertzman, Deann and Lange, Pamela and Myers, Rebecca and Reiner, Nicol and Uhre-Balk, Nicole and Webber, Kimberly",2024,"This paper describes a research-practice partnership (RPP) in western South Dakota involving twenty 4th and 5th grade teachers and a support team of university researchers and K-12 learning specialists. For three years, the RPP has been exploring ways to strengthen computational thinking within elementary math and science instruction, attending to policy considerations and the local education landscape. The RPP is motivated in part by the hypothesis that a larger, more diverse group of students will choose to enroll in computer science courses in high school if they gain familiarity and confidence related to computational concepts at earlier grades. Feedback from participating teachers along with student attitude and problem-solving data suggest this is a promising approach."
Study on Mode of Cultivating Computational Thinking in Online Teaching of Information Technology:A Quasi-Experimental Study,"Yang, Hairu and Liang, Zhou and Ma, Mingyue and Zhang, Xiaoyu and Fu, Yan and Zhang, Yongmei",2024,"With the development of the digital age, online teaching and learning is becoming more widespread in schools around the world. In the online teaching environment, the teaching mode of the course is an important element that receives attention in education and teaching. The online teaching mode based on the cultivation of computational thinking can improve students' learning interest and cultivate their innovative thinking ability. However, the author found through educational internship that there are problems such as single teaching activities, lack of teacher-student interaction, poor cooperative learning, and short independent learning time in high school information technology classrooms, which lead to low computational thinking ability and are not conducive to the development of students' innovative ability. The development of students' computational thinking ability is a requirement put forward by the high school information technology curriculum to secondary school students, and the improvement of computational thinking can help students adapt to the future society and meet the demand of future innovative talents. Therefore, this study takes high school students as the research object, under the guidance of constructivism and cognitivism theories, adopts survey research, experimental research and other research methods to construct and verify the online teaching mode based on the cultivation of computational thinking in high school information technology courses. The results of the study show that the online teaching mode based on the development of computational thinking can effectively improve students' algorithmic, evaluation, decomposition, abstraction and generalization thinking abilities, and thus enhance the online learning effect."
Supporting Teacher Understanding of Computational Thinking Integration into Early Elementary Curricula,"Sherwood, Heather and Kaiser, Alice and Ferguson, Camille and Negron, Anthony and Ferrer, Ray and Labonte, Don",2024,"The recent emphasis on computational thinking (CT) integration across disciplines in elementary education nationwide is important to ensure that students are well-equipped to meet the demands of the data-driven workforce. However, this requirement poses major challenges to early elementary teachers who are faced with little direction in terms of how best to implement and assess their young student's application of these new practices.This project engaged researchers, professional development (PD) providers, and K-2 teachers to develop and design a hybrid PD experience to support teachers in a process of learning about and identifying the use of CT skills and strategies in their students' work. The hybrid PD approach utilized a combination of instructional coaching, both face-to-face and through an online Community of Practice. Researchers used a mixed-methods design to measure teachers' change over time in their understanding of how to identify emergent computational thinking in their students' work process. Data collection methods included teacher focus groups and interviews, classroom observations, and teacher pre- and post-surveys.Preliminary findings showed an increase in teachers' understanding of CT and confidence in engaging their students in CT-integrated lessons. Teachers reported that the combination of in-person PD and online Community of Practice helped them prepare to bring CT into their classroom and cited placing more of a distinct focus on teaching students the process of CT rather than just using CT vocabulary. Teachers also referenced success in evaluating their students' application of CT skills and concepts by using informal and formative assessment strategies that focus on evidence of student understanding rather than assessing CT vocabulary."
Teacher Education and Computational Thinking: Measuring Pre-service Teacher Conceptions and Attitudes,"Yadav, Aman and Caeli, Elisa Nadire and Ocak, Ceren and Macann, Victoria",2022,"In recent years, there has been a growing awareness of the need for computer science education opportunities and particularly for engaging students in computational thinking ideas and practices to help them understand how computing influences our world. At its core, computational thinking (CT) is seen as understanding how computational practices (such as, abstraction) and tools (such as modeling software) can be used to explore phenomena, solve problems, and influence our lives and society. The push for CT integration has called for preparing future educators to learn CT practices and tools through stand-alone courses and within the context of disciplinary pedagogy/methods courses. However, there are few instruments that measure pre-service teachers' attitudes towards computational thinking and its role in formal schooling. In this study, we developed and validated an instrument to measure pre-service teachers' attitudes towards CT, its role in students' lives, and their own self-efficacy to incorporate CT into their teaching. We report results from a principal components factor analysis on survey responses from 260 pre-service teachers to identify patterns and reduce the number of dimensions of comparison in the analysis. We discuss how pre-service teacher conceptions have implications for preparing future teachers to integrate computational thinking into their instruction."
Teacher Education to Integrate Computational Thinking into Elementary Science: A Design-Based Research Study,"Killen, Heather and Coenraad, Merijke and Byrne, Virginia and Cabrera, Lautaro and Mills, Kelly and Ketelhut, Diane Jass and Plane, Jandelyn D.",2023,"Computational thinking (CT) is playing an increasingly relevant role within disciplinary teaching in elementary school, particularly in science. However, many teachers are unfamiliar with CT, either because their education occurred before the popularization of CT or because CT instruction was not included in their pre-service coursework. For these teachers, CT professional development (PD) becomes a primary mechanism to close their CT knowledge gap. While CT PD has demonstrated success at increasing teacher's CT understanding, researchers have reported varied outcomes in supporting teachers to write CT-integrated lesson plans. To explore how we might support teachers to integrate CT into elementary science, we employed design-based research (DBR) in a dual-track design of in-class CT instruction for pre-service undergraduates within an elementary science methods class paired with a collaborative, multi-month PD opportunity for pre- and in-service teachers. In this article, we reflect on our 5-year period of DBR and present our design insights and implications for CT instruction and curriculum design from each iteration. Our findings on best practices will inform both teacher educators and PD providers within CT education. Our work will also be of interest to researchers considering DBR for technology-based educational projects."
TeachVR: An Immersive Virtual Reality Framework for Computational Thinking based on Student Preferences,"Wee, Chyanna and Wang, Lillian Yee Kiaw and Ong, Huey Fang",2025,"This study presents the development of a student-centric framework for utilizing virtual reality (VR) technologies in education, specifically focusing on enhancing computational thinking skills. While numerous frameworks exist in this domain, they often lack consideration of student preferences, which are integral for fostering learner autonomy. Our proposed framework, with components developed from the constructivist learning theory, emphasises creating knowledge through interaction with the environment, focusing on autonomy, mastery, and purpose as drivers of intrinsic outcomes. Through a survey administered to hundred and fifty-seven participants, we sought to identify student-preferred strategies for learning computational thinking skills via VR interventions. Results highlighted key challenges students face when working on computational tasks are related to algorithmic and abstraction thinking. To ease the aforementioned challenges, our findings suggest a preference among students for situated-based learning approaches within VR environments. Additionally, participants recognized the importance of motivational outcomes in improving autonomy and mastery within VR-based learning tasks. Students also preferred tasks that enhanced self-efficacy, contributing to a greater sense of purpose in their learning endeavours. Overall, this investigation sets a foundation for more student-centric, constructivist, and intrinsically-based VR frameworks in education."
The Association between Computational Thinking and Mental Models in Talented Children (Doctoral Consortium),"Kunz, Katrin",2024,"This doctoral research explores the link between computational thinking (CT) and mental models in talented children, addressing a gap in empirical studies on effects of computer science interventions. The research employs a mixed methods approach, utilizing randomized controlled field studies and interviews with primary school students attending computational thinking courses. Thus, two new computational thinking interventions have been developed and will be evaluated by a pilot, efficacy, and effectiveness study including either a wait-list or treated control group. The test instrument measuring mental models will first be employed in semi-structured interviews with talented children attending these computational thinking courses and then subsequently implemented in randomized controlled field trials to compare the effects of the courses on computational thinking abilities and the development of stable and viable mental models."
