0,1,2,3
Computational Thinking for Self-Regulated Learning,"Pasterk, Stefan and Benke, Gertraud",2024,"In this theoretical paper, we compare computational thinking and self-regulated learning. Many studies use self-regulated learning to foster the acquisition of computational thinking competencies. Self-regulated learning skills are themselves beneficial for any learning process; here, we argue that the relationship between self-regulated learning and computational thinking is closer than the simple observation that self-regulated learning strategies support the acquisition of computational thinking competencies. We sustain that self-regulated learning and computational thinking competencies share many features (and have some differences), which would support synergistic effects so that not only can self-regulated learning be used to attain computational thinking competencies, but computational thinking activities can also be used to foster features of self-regulated learning competencies."
Computational Thinking in STEM Teaching: Preservice Teachers' Conceptualizations and Practices,"Wei, Wei and Ha, Jesse and Gomez, Kimberley and Ghosh, Anuradha",2024,"Within a two-year urban teacher residency program at [University], which focuses on training high school teachers to incorporate computational thinking (CT) into STEM education with an emphasis on equity, this study delves into how these preservice teaching residents (TRs) understood and applied CT in high school STEM settings. Based on our initial thematic content analysis of ten 30-minute artifact-based interviews, teachers' understanding and application of CT could be categorized in two ways: 1) One group of teachers showcased clear, explicit knowledge of CT and actively incorporated it into their instruction; 2) Another group, despite their evident understanding of CT, subtly and implicitly integrated CT into their teaching methods. Our findings suggest that while TRs may differ in whether they explicitly or implicitly integrated CT into their lesson plans, their comments suggest that they have foundational understandings and hold values that suggest they can build upon them. The TRs held definitional understandings of CT and had intentions to design and teach with CT integration, explicitly, or more commonly, implicitly. All of the TRs recognized opportunities in their lesson plans for teaching CT to students, which suggests the potential for more explicit integration in the future. These insights guide our subsequent efforts in teacher training, ensuring educators are equipped to weave CT into STEM lessons. Our findings contribute to a growing body of work that seeks to build strong preservice teaching practices, as they learn to translate CT knowledge into effective teaching practices while working towards higher levels of CT integration."
Computational Thinking Integration Design Principles in Humanities,"Caskurlu, Secil and Hu, Anne Drew and Yadav, Aman and Santo, Rafi",2022,"In this poster, we will present approaches and associated design principles for integrating computational thinking (CT) into middle school Social Studies, Arts, and Language Arts instruction to enhance disciplinary learning. We used four steps to identify these approaches and design principles: (1) co-design with teachers and experts in computer science and CT education to ideate CT-integrated lessons; (2) identifying initial design principles based on the ideated lessons; (3) consultation with subject matter experts; and (4) conducting a Delphi study with pedagogical experts (e.g., teachers, curriculum writers, teacher educators) to examine the clarity, feasibility and potential impact of the design principles. The process led to three broad approaches to integrate CT into Social Studies instruction that included 14 design principles, three for Arts with 16 design principles, and four for Language Arts with 12 design principles."
Computational Thinking Interventions in Higher Education: A Scoping Literature Review of Interventions Used to Teach Computational Thinking,"de Jong, Imke and Jeuring, Johan",2020,"Computational Thinking is seen as a crucial skill in an increasingly digital society. Researchers and educators in higher education therefore aim to improve the Computational Thinking (CT) skills of students using appropriate interventions. However, there is currently no overview of interventions used to teach CT and how effective they are. With this scoping literature review, we provide such an overview by identifying articles that discuss interventions used to teach CT in higher education. We identify the teaching approaches used in these interventions, and discuss their effectiveness and how this is assessed. Furthermore, we look at the use of adaptive interventions. Our search of three academic databases (Scopus, ACM and ERIC) resulted in 1839 articles. After screening, 49 articles remained. A detailed examination of the interventions discussed in these articles showed that CT is still often taught through programming assignments. The interventions are evaluated in a myriad of ways, making it difficult to compare the effectiveness of interventions. We therefore suggest making use of more standardized instruments to evaluate the effectiveness. Finally, although scaffolding is applied, interventions are not often adapted to the actual proficiency level of a student."
Computational Thinking on Mathematical Problem-Solving: Bibliometric Theme and Aspect,"Susanti, Reni Dwi and Lukito, Agung and Ekawati, Rooselyna",2024,"This study aims to investigate current trends and key elements of computational thinking in problem-solving within mathematics education. A systematic literature review was conducted using the 2013-2013 Scopus database, focusing on the keyword ""computational thinking in mathematics education"" for document collection. Data analysis was visualized using R-studio software. The thematic analysis revealed two major fields that extensively research computational thinking: education and engineering. Additionally, six research themes emerged from the analysis, including Mathematics, Computer Science, programming, STEM, robotics, and engineering. Key aspects for identifying computational thinking in solving mathematical problems encompass problem identification, decomposition, pattern recognition, abstraction, algorithms, and debugging."
Computational Thinking Resources Inspired by Bebras,"Lehtim\""{a}ki, Taina and Monahan, Rosemary and Mooney, Aidan and Casey, Kevin and Naughton, Thomas J.",2023,"In this poster, we highlight computational thinking resources for schools from the PACT team at Maynooth University, Ireland. The resources are derived from tasks from the Bebras international computational thinking initiative. The different modalities work together throughout the school year to provide initial exposure to computational thinking, and include an obstacle course, seasonal tasks, and a workbook."
Computational Thinking through Tangible Play: Understanding Social Dialogues in Children's Learning,"Liu, Yu-Yu and Iversen, Ole Sejer",2022,"Through an exploratory study of a 6-year-old child and his parents, we explored the complexities of children's affective learning experience with tangible programming games, specifically focusing on the impact of scaffolding dialogues and social-emotional support. The social dialogues from this exploratory study demonstrate the interactive reasoning process in computational thinking (CT) education and reveal that dialogic learning has the potential to promote learning emotions and CT skills development in CT education. This study thus points to the future Child-Computer Interaction (CCI) research agenda that considers social dialogues in CT education with tangible play. A new understanding of social dialogues in CT toys and CT education can provide educators and CCI researchers with socio-technical insights into the future educational practices and design of CT games and technology for young children."
Construction and Practice of Computational Thinking Structural Framework with Sternberg's Intellectual Education Theory,"Zhang, Wei and Song, Lingling and Huang, Xujun and Wang, Yi",2024,"Cultivating students' computational thinking skills is one of the important teaching goals of college computer courses, and constructing a scientific and effective structural framework for computational thinking is the basis for implementing computational thinking training. To this end, based on Sternberg's intelligence education theory, combined with software development and programming knowledge, a structural framework of computational thinking was constructed. Subsequently, a project-based teaching activity based on this framework to cultivate students' computational thinking skills was carried out in the college computer programming course ""Software Development Technology"". By measuring students' computational thinking skills before and after the activity, it was verified that the project-based teaching model based on the proposed framework had a significant effect on improving students' computational thinking skills. By constructing a structural framework of computational thinking that integrates the characteristics of disciplines, and taking programming teaching as a carrier to implement the cultivation of computational thinking skills, it can provide a new way for computer educators to cultivate students' computational thinking skills."
Construction and Validation of an Online Teaching Model for the Development of Computational Thinking: Take high school information technology course as an example,"Yang, Hairu and Li, Qiuhong and Dong, Jiamin and Bai, Xinye and Cai, Minghan and Xu, Xiang",2023,"In the information age, online teaching will gradually become an inevitable trend in the era of modern education informatization. Online teaching has the advantages of easy operation and abundant resources, but it has higher requirements for the design of teaching mode and teaching content. Computational thinking, as the core idea of IT teaching, emphasizes the long-term development and deep development of IT learning, which has great practical significance for students to improve themselves and cultivate their ability development. So in the online teaching of high school IT courses, how to build an online teaching mode suitable for students' development and achieve the purpose of effectively cultivating students' computational thinking? This study combines specific teaching, guided by constructivist theory, nearest developmental zone theory, situational cognition and other theories, and uses literature research method, questionnaire survey method, quasi-experimental research method and other research methods to conduct a study on the construction and validation of online teaching model of high school information technology geared to the cultivation of computational thinking. The results of the study showed that the proposed teaching model was found to have a significant promotion effect on students' academic performance and computational thinking through the examination of students' academic performance and computational thinking."
CT Readiness for All: Studying a Framework for Supporting Schoolwide Computational Thinking Integration Across Elementary Curricula,"Sherwood, Heather and Moeller, Babette and Fancsali, Cheri",2024,"Schools throughout the United States are engaging in efforts to integrate computational thinking (CT) across various elementary curricula. However, there is very little guidance for effective approaches to integrating CT consistently and cohesively school wide. CT Readiness for All is a two-year research project that is investigating a CT framework and self-assessment tool developed to articulate indicators associated with successful school-wide integration across elementary curricula. Data sources include focus group interviews and surveys with teachers. Although the project is still in progress, early analysis have resulted in three key findings: (a) students were able to make cross-curricular connections using CT as a problem-solving process; (b) finding time within the school day to focus on CT is challenging; and (c) administrators need to take an active role in setting the vision and definition of CT to support school-wide CT efforts."
Demo: Teaching computational thinking with Protobject,"Bellino, Alessio",2023,"In today’s rapidly changing world, computational thinking is becoming increasingly essential. However, many people, including middle and high school students, face obstacles when learning to code, such as a lack of motivation and engagement. To address this challenge, we present Protobject, an accessible tool that teaches programming in a unique and interactive way. Protobject allows people to explore programming concepts through hands-on physical computing, providing a more engaging and motivating learning experience. In this demonstration, we invite conference attendees to delve into the features of Protobject and witness its potential for enhancing programming education. Participants will have the chance to interact with the tool’s user-friendly interface and explore a range of 22 interactive learning activities that offer different levels of difficulty."
Design and Implementation of Co-design Pedagogical Scenarios for Learning Computational Thinking,"Sunday, Amos Oyelere",2023,"Recognizing effective approaches to communicate computational thinking (CT) ideas to K-12 learners is necessary. Co-design approach has been identified as an effective pedagogy for communicating CT ideas. However, there is a dearth of studies on co-design pedagogical scenarios. Hence, this study aimed at developing a CT learning co-design scenario, translate into artifact, and implement with Nigerian secondary school students."
Designing for Equity in Education Via Computational Thinking: A Case Study,"Yamaguchi, Ryoko and Eaton, Cyntrica",2024,"CADRE (Catalyst for Actively Designing and Researching Equity) is a Researcher-Practitioner Partnership (RPP) that empowers in-service K-12 educators to learn and leverage Computational Thinking (CT) to design for equity in their classrooms, schools, and districts. We cast equity gaps as bugs in education and focus on helping educators debug the system with CT-based tools, methods, and strategies such as user-centered design, system abstraction, and iteration. In this paper, we first describe how educators were taught CT and provide an example of how they applied these skills in practice. We then highlight the results of the qualitative case study of 34 educators where we found that CT helped CADRE participants gain a better understanding of the equity gaps their students faced and improve their instructional practices within their locus of control. Implications for future research are also discussed."
Designing Project-based learning experiences to integrate Computational Thinking skills at Teacher Colleges,"Simmonds, Jocelyn and Hitschfeld-Kahler, Nancy and Scheihing, Eliana and Henriquez, Valeria and Munoz, Valentin and Casanova, Cecilia and Torrent, Catalina and Contreras, Paulo and Mercado, Karen and Estrada, Daniel and Marquez, Lucia",2024,"We describe our experience introducing computational thinking skills at teacher colleges through project-based learning (PBL). We have designed projects that use technology to tackle driving questions derived from the national school curriculum, and at the same time are aligned with learning objectives from pre-service teacher training programs. We have carried out a preliminary validation of these projects with teacher educators, who are now incorporating these experiences into their courses with pre-service teachers."
Developing a Digital Game to Assess Lower Primary Students' Computational Thinking Practices based on Evidence-Centered Game Design,"Luo, Qi and Zhang, Shuhan",2025,"Computational Thinking (CT) has become increasingly essential in the current era of rapid digital advancement. Despite the availability of various tools to assess CT, there is a notable scarcity of tools designed for evaluating CT practices in lower elementary students. To address this gap, this study develops a digital game titled ""Magical Adventure"" based on the Evidence-Centered Game Design (ECGD) framework, which aimed at assessing the CT practices of young children. The game comprises five scenarios, targeting five CT practices respectively, including pattern recognition, abstraction, problem decomposition, algorithmic thinking, and debugging. Scoring criteria were designed to evaluate students' CT abilities based on the anticipated gameplay process data. This study describes the design and development process of the game. Future steps will include validation of its effectiveness through expert reviews and cognitive interviews, followed by empirical research to optimize and refine the game, enhancing its accuracy in reflecting students' CT practices."
Developing a Self-efficacy Scale for Computational Thinking (CT-SES),"De Jong, Imke and Jeuring, Johan",2022,"Self-efficacy is an important construct in education, as it can influence (among other aspects) perseverance, engagement and success on educational tasks. As such, a student’s Computational Thinking (CT) self-efficacy can have an important influence on, and may be a predictor for, the development and use of CT skills. This poster abstract provides the details of an in-progress study in which we develop a scale to measure CT self-efficacy in different contexts."
Developing Computational Thinking in Middle School Music Technology Classrooms,"McCall, Lauren and Allen, Brittney and Freeman, Jason and Garrett, Stephen and Grossman, Sabrina and Paz, Jed and Edwards, Doug and McKlin, Tom and Lee, Taneisha",2024,"To engage diverse populations of students who may not self-select into computing courses, a curriculum for a middle school music technology + computer science course that addresses learning standards for both subjects was developed and deployed. Students who engage with the curriculum learn modern music production techniques and computational thinking concepts. This is through a mix of traditional approaches to music technology education (digital audio workstations) and computational approaches via a culturally relevant learning platform that introduces students to coding through music production and remixing. This poster reflects on the last two years of curriculum design and deployment, teacher training, and student and educator engagement and feedback to provide insight into the teaching (and learning) of computational thinking in the music technology classroom."
Development of an Open-Source Emotion-Based Adaptive Learning Support System using Computational Thinking Activities,"Herrero-\'{A}lvarez, Rafael",2023,This report summarizes the information related to a PhD project that aims to develop an Open-Source Emotion-Based Adaptive Learning Support System through Computational Thinking activities. This paper outlines the proposed objectives and provides an update on the progress made in research to date.
Does Musical Context Improve Computational Thinking Skills?,"Padhye, Harsh and Gibson, Rachel and Bull, Glen and Nguyen, N. Rich",2023,"The Make-To-Learn Lab at the University of Virginia developed TuneScope, a tool to facilitate computational thinking (CT) through music, to help democratize computer science education. Built upon the existing framework of Snap! (University of California, Berkeley), TuneScope leverages sound analysis, design, and music composition to engage novices with CT fundamentals. Existing research shows the benefits of using familiar contexts to teach CT, and TuneScope builds upon this with musical contexts. We have designed a course centered around the use of TuneScope to teach fundamentals of CT through music. In this paper, we investigate how students use TuneScope to develop sequential melodies, build chords, and sample recorded sounds while simultaneously learning fundamental programming principles such as algorithm design and abstraction. Using sentiment analysis, we demonstrate that students have had a largely positive experience in learning and grasping CT fundamentals throughout a diverse curriculum. As of today, the total enrollment of the course consists of over 45% female students with a 100% retention rate. TuneScope has also been accepted as an official Snap! library to be used by thousands of Snap! users worldwide."
Embracing Mathematical Conjecture Through Coding and Computational Thinking,"Castle, Sarah D.",2024,"Mathematics and computer science education have an intertwined history as proof undergirds both disciplines. This initial instrumental case study follows 16 different computational science students through a series of 8 linear algebra modules. Thematic analysis was used to highlight that when students learn mathematics through computation, opportunities for conjecture can be fostered alongside computational thinking."
Encouraging the Development of Computational Thinking Skills through Structured Dance Activities (Discussion Paper),"Fairlie, Fiona",2024,"This paper investigates whether aspects of structured dance and choreography may improve cognitive skills related to computational thinking. It also explores the relationship between performance on computational thinking tasks and motivation. Twenty participants,aged between 7 and 9 years old, undertook the Beginners Computational Thinking Test (BCTt) as a pre-test, took part in three dance related workshops then completed the BCTt as post-test and responded to an adapted version of the Intrinsic Motivation Inventory (IMI). Student performance on the BCTt improved significantly from pre-test to post-test for both boys and girls and seems generalised across the computational categories measured by BCTt. The study did not show a correlation between performance and motivation in girls but suggests that there may be some correlation between improvement in score and reported enjoyment in boys."
"Enhancing Computational Thinking with 3D printing: Imagining, designing, and printing 3D objects to solve real-world problems.","Grizioti, Marianthi and Kynigos, Chronis and Nikolaou, Maria-Stella",2024,"Printing 3D objects is exciting and engaging for young learners. However, how can this emerging technology benefit the development of skills, such as Computational Thinking (CT) and Design Thinking (DT), through a meaningful process of imagining, designing and tinkering with objects that could be used in real-world problems? Our knowledge is still limited, due to the complexity of designing 3D printable models from scratch with the existing digital tools. This paper discusses a web-based tool that enables learners to create and dynamically manipulate the behavior and properties of 3D printable models with high-level programming. This design aims to foster computational thinking, creativity, and design thinking skills as it focuses on the design process of the model, its behavior and its usage after printing. It also presents the results of a pilot study in which secondary school students engaged in a Design Thinking project for designing and printing sustainable everyday objects using this design. The study revealed new kinds of educational potential of 3D printing including the understanding of complex mathematical and CT ideas that were too complicated before, and the connection of CT practices with real-world problems through the implementation of a Design Thinking project with digital media."
Enhancing the Role of Computational Thinking in Primary and Secondary Education in Switzerland,"Arnold, Ruedi and Amstalden, Barbara and Bader, J\""{o}rg",2022,"Computational Thinking (CT) is a fundamental and important skill set in our world and should therefore be taught and practiced in school. In this poster abstract, we present our ongoing initiative on establishing CT as a fundamental and interdisciplinary contribution of Computer Science as a necessary component of general education and describe our aim to enhance the knowledge about it in Switzerland’s teacher communities. We give an outline of our planned activities and present first results from a field test in a Swiss high school with an original example of CT-tailored teaching material for the subject of logic."
Examining the Use of Computational Thinking Skills When Solving Bebras Tasks,"De Jong, Imke and Sichterman, Bo and Jeuring, Johan",2022,"Computational thinking (CT) is considered an essential problem-solving skill in the 21st century, and is receiving attention on different educational levels. To promote and assess students’ CT skills, so-called ’Bebras tasks’ (i.e. small tasks for problem solving in informatics) are created by experts in the field of CT. There has not been empirical research to determine to what extent and how CT skills are used while solving these tasks, however. This qualitative study bridges this gap by using the think-aloud method to examine the use of CT skills when solving Bebras. The results of this study can serve as a validation for the use of CT skills in solving Bebras tasks. This poster abstract introduces the background and setup of the study."
