0,1,2,3
A Computational Thinking Obstacle Course Based on Bebras Tasks for K-12 Schools,"Lehtim\""{a}ki, Taina and Monahan, Rosemary and Mooney, Aidan and Casey, Kevin and Naughton, Thomas J.",2023,"This paper describes an unplugged computational thinking (CT) resource for primary and secondary schools developed from Bebras tasks. In Ireland, CT is not part of the primary school curriculum or mandatory in secondary schools. However, the National Council for Curriculum and Assessment is in the process of revising the primary school curriculum to include aspects of CT. Our aim for creating this CT Obstacle Course is to introduce teachers (and pupils) without formal computer science training to the subject of CT. This is done in a manner that informs and motivates, and gives them the confidence to deliver CT materials in the classroom. We also want to find out from teachers how useful and important this type of resource is for developing problem-solving skills, and if our unplugged activity can support learning at various skill levels. Our CT Obstacle Course includes 14 Bebras tasks for primary schools and an additional 6 Bebras tasks for secondary schools. The activity is suitable for indoors and outdoors and is completed in groups, promoting teamwork and communication. We have delivered it to 146 primary school classes during 38 school visits between May 2021 and June 2022. It has been undertaken by 3,445 pupils and 195 teachers and other school staff. This paper describes our CT resource in detail, and reports teacher feedback from primary schools."
A Computational Thinking Test for Senior High School Students,"Hu, Chiu-Fan and Wu, Cheng-Chih",2023,"We have developed a quantitative tool for assessing senior high school students' computational thinking skills and administered it in the Taipei metropolitan area of Taiwan. Our CT test is language/tool/knowledge-independent and focuses on four key CT concepts: decomposition, data representation, algorithms, and pattern generalization. Our paper outlines the development process of the CT test, including its constructs, reliability, and validity, and discusses its educational implications for computing courses. This CT test provides a valuable resource for computing teachers who wish to assess their students' CT abilities and tailor their teaching methods accordingly."
An empirical study on the design-based STEM + VR teaching approach to cultivate college students' computational thinking,"Li, Xing and Zhao, MingYue and Ai, Di and Zhou, XiaoChun and Xiang, Hui",2024,"Virtual reality (VR) technology has been widely used in many industries. Therefore, the cultivation of virtual reality technology talents is imminent. However, there are relatively few universities that carry out virtual reality courses. At the same time, the virtual reality course is a good carrier to cultivate computational thinking. It can improve students ' problem-solving ability, creativity and teamwork ability, which are also necessary to cultivate computational thinking. Computational thinking, as a necessary basic skill for talents in the 21 st century, needs to be improved in the training approach of college teaching. However, there are relatively few teaching approachs to cultivate computational thinking through virtual reality (VR) courses. Based on this, this study constructs a design-based STEM+VR teaching approach, which combines the interdisciplinary knowledge of STEM education with VR subject knowledge, aiming to cultivate college students ' computational thinking through virtual reality courses. In this study, a single group of pre-test and post-test experiments were conducted to investigate the complex ability of computational thinking of a college student in Wuhan, including five sub-dimensions:creativity,algorithmic hinking, collaborative ability, critical thinking and dimensional problem solving.The research shows that after the design-based STEM + VR teaching, the abilities in the sub-dimension of computational thinking are significantly improved. The design-based STEM + VR teaching case provided in this study is expected to provide some reference for the use of virtual reality courses to cultivate computational thinking in college education."
An Intelligent Pedagogical Agent for In-The-Wild Interaction in an Open-Ended Learning Environment for Computational Thinking,"Murali, Rohit and Lall\'{e}, S\'{e}bastien and Conati, Cristina",2024,"Adaptive support can help learners in Open-Ended Learning Environments (OELEs), where the free-form nature of the interaction can be confusing to students. In this paper, we design and evaluate an Intelligent Pedagogical Agent (IPA) for an OELE designed to foster Computational Thinking (CT). Specifically, we design help interventions for an in-the-wild scenario where students interact with the OELE in an unmonitored, self-directed manner. We build a student model by extracting meaningful student behaviors on real-world interaction data obtained during interaction in online classrooms and including expert insights. We show that these student models perform better than a baseline and have the potential for adaptive support in self-directed interaction with the OELE. We design an IPA with the help of teachers, leveraging the student behaviors extracted from data. Lastly, we get insights into the value of these help interventions by empirically evaluating the IPA in a formal user study."
Analyzing Computational Thinking Gameplay: Identifying Struggles and the Role of Experience,"Veng, Sotheara and Zhang, Yifan and Bergwall, Ekaterina and Rutherford, Teomara",2025,"Computational thinking (CT) skills are essential for navigating daily life, but how best to teach these skills is still being explored. Educational programming games can provide engaging environments to develop CT, yet uncovering student struggles during gameplay remains challenging. This study analyzed 15 undergraduates with varying programming experience playing the CT game, Fox and Field, utilizing gameplay videos, heart rate data, and surveys. Results revealed common struggle points in understanding the character's perspective, degree angles, and debugging, with notable differences between novice and experienced players. Findings suggest support targeting abstraction, pattern recognition, and debugging skills to improve future game design and scaffolding."
Analyzing-Evaluating-Creating: Assessing Computational Thinking and Problem Solving in Visual Programming Domains,"Ghosh, Ahana and Malva, Liina and Singla, Adish",2024,"Computational thinking (CT) and problem-solving skills are increasingly integrated into K-8 school curricula worldwide. Consequently, there is a growing need to develop reliable assessments for measuring students' proficiency in these skills. Recent works have proposed tests for assessing these skills across various CT concepts and practices, in particular, based on multi-choice items enabling psychometric validation and usage in large-scale studies. Despite their practical relevance, these tests are limited in how they measure students' computational creativity, a crucial ability when applying CT and problem solving in real-world settings. In our work, we have developed ACE, a novel test focusing on the three higher cognitive levels in Bloom's Taxonomy, i.e., Analyze, Evaluate, and Create. ACE comprises a diverse set of 7x3 multi-choice items spanning these three levels, grounded in elementary block-based visual programming. We evaluate the psychometric properties of ACE through a study conducted with 371 students in grades 3-7 from 10 schools. Based on several psychometric analysis frameworks, our results confirm the reliability and validity of ACE. Our study also shows a positive correlation between students' performance on ACE and performance on Hour of Code: Maze Challenge by Code.org."
Appalachian Ingenuity and the Need for Rurally Sustaining Computational Thinking Pathways,"Dunbar, Kyle M. and Coenraad, Merijke and Iwatani, Emi",2024,"Our research-practice partnership with two school districts in Eastern Kentucky has created a rurally sustaining computational thinking (CT) pathway. In this paper we share our project's operational understanding of the concept of rural sustainability in the context of CT pathways. We posit that an effective CT pathway for rural communities must be firmly rooted in their cultural wealth, funds of knowledge, and socioeconomic priorities. Moreover, it should empower students to draw upon their own innovation heritage, leveraging CT as a tool to identify and address community challenges. Emphasizing the necessity of incorporating rural contexts into discussions on equitable access to computing education, our conceptualization provides insights into how policy and research can contribute to this important goal."
Applying a Blended Board Game System with Robotic Arm for Training Computational Thinking: Learning through Human-Machine Competition,"Yong, Lin and Zhan, Zehui and Zou, Xuanxuan and Chen, Li and Lin, Zhihang and Zhan, Weiyu",2023,"The purpose of this study is to design and developed a blended board game system with robotic arm for training students' computational thinking, and examine its effect in an elementary school's information technology course. A board game virtual interface was developed based on Unity-3D, and the corresponding device with a robotic arm was set up based on ESP32-CAM development board. The learning system enables a dual interaction mechanism by learning through Human-Machine Competition virtually or physically. By participating in the game, students faced challenges such as board game step reasoning, model abstract, decision-making, and strategic planning, thereby enhancing their computational thinking and problem-solving skills. Results indicated that the blended board game improve students’ overall computational thinking skills, especially reasoning, decision-making and strategic planning. This research provides an innovative approach to develop virtual-physical integrated game-based learning system for promoting students' computational thinking through human-machine competition."
Assessing Elementary Teachers' Knowledge of Integrated Computational Thinking,"Joshi, Deepti and Joswick, Candace and Albert, Jennifer and Jocius, Robin and Blanton, Melanie and Petrulis, Robert and Dawson, Trent",2025,"During the UnboxingCT project summer professional development, the Integrated CT Assessment was piloted with 72 elementary teachers. The assessment is based on computational thinking integration literature and asks teachers to identify different computational thinking concepts in content area scenarios. The assessment allowed us to identify which computational thinking concepts teachers were most familiar with prior to the professional development and assess changes in their understanding following the professional development. Our next step will be validation of the assessment with a larger group of teachers."
Assessing Pre-Service Elementary Science Education Teachers’ Professional Knowledge in the Field of Computational Thinking,"Arndt, Nicolas and Br\""{u}ckmann, Maja",2023,"Computational thinking is a key competence for children to learn in today’s digitized world. In order to effectively teach computational thinking, elementary science teachers need to have appropriate professional knowledge, consisting of content as well as pedagogical content knowledge and pedagogical knowledge [15]. This research project will adapt the Computational Thinking Test (CTt) to assess German pre-service teachers’ content knowledge in the area of computational thinking, and develop corresponding items based on case vignettes to assess pedagogical content knowledge."
Best Practices for Developing Computational Thinking,"Garcia, Dan and Garcha, Sonia and Mukund, Madhavan and Shah, Vipul",2023,"CSforALL is an umbrella term for a movement that seeks to bring engaging, culturally-relevant, and meaningful computer science to all students. It includes many avenues for learning – after-school outreach activities, once-a-year ''Hour of Code'' activities as well as formalized instruction in classes, led by an inspiring and well-prepared teacher. There is a perennial need to support pre-service and in-service teachers with curricula and pedagogical content knowledge (PCK) so they can be successful in the classroom, but where to start?Jeannette Wing has long evangelized computational thinking (CT) as a skill ''for everyone, everywhere. Computational thinking will be a reality when it is so integral to human endeavors it disappears as an explicit philosophy''. [2] We have found that CT offers a remarkable foundation of engagement, intuition, and grounding upon which to build higher-level computer science fluency. This panel brings together four seasoned experts who have collectively provided computer science and CT professional development to a vast multitude of teachers and students to share their best practices."
Beyond Programming: A Computer-Based Assessment of Computational Thinking Competency,"Lai, Rina P. Y.",2021,"Computational Thinking (CT), entailing both domain-general and domain-specific skills, is a competency fundamental to computing education and beyond. However, as a cross-domain competency, appropriate assessment design and method remain equivocal. Indeed, the majority of the existing assessments have a predominant focus on measuring programming proficiency and neglecting other contexts in which CT can also be manifested. To broaden the promotion and practice of CT, it is necessary to integrate diverse problem types and item formats using a competency-based assessment method to measure CT. Taking a psychometric approach, this article evaluates a novel computer-based assessment of CT competency, Computational Thinking Challenge. The assessment was administered to 119 British upper secondary school students (M = 16.11; SD = 1.19) with a range of prior programming experiences. Results from several reliability analyses, a convergent validity analysis, and a Rasch analysis, provided evidence to support the quality of the assessment. Taken together, the study demonstrated the feasibility to expand from traditional assessment methods to integrating multiple contexts, problem types, and item formats in measuring CT competency in a comprehensive manner."
Bridging the Gap: Computational Thinking as a Pathway to Equitable Math Education for Neurodiverse Learners,"Kastelein, Kate and Dawson, Kelsie and Tate, Rhonda",2024,"Students who receive special services in mathematics or neurodiverse learners (NDLs) deserve to learn mathematics at a rigorous and equitable level as their peers. Yet, many of these students are not reaching proficiency. Computational thinking (CT) may function as a bridge between students' mathematical learning and their everyday lives. We argue that computational thinking is a pathway for NDLs to follow that will bridge the connections between math instruction and the real-life problems with which NDLs are eager to engage. We identified the critical elements needed to support rural special educators' integration of CT into math instruction by identifying intersections between CT, Math, and the assets of NDLs, as well as barriers to implementation. By leveraging connections from an existing RPP (Research-Practice Partnership), which focuses on CS education and Business intersection in rural Maine schools, we created an opportunity for participatory research for special educators and paraprofessionals often overlooked in these processes. We employed a multi-method, design-based research (DBR) approach. Through observational, survey, and interview data, we found that 1) educators are not currently receiving support for integrating CT in special education classrooms, 2) activities piloted by our educators were well received by students, 3) current standards and Individualized Educational Plan (IEP) requirements for NDLs are a significant barrier to implementation. The need for expanded, regular PD for special educators is evident, as is the potential for CT as a bridge for mathematical understanding for NDLs."
Building Awareness of Computational Thinking Pathways across a Large School District,"Rangel, Alessandra and Coenraad, Merijke and Ruiz, Pati and Dunbar, Kyle and Milenkovic, Lisa and Arriola, Sheryl and Marousky, Annmargareth",2024,"As states move to adopt computer science (CS) and computational thinking (CT) standards to prepare students for an increasingly technological world, school districts are integrating curriculum with CT skills and practices, building the capacity of their teachers and administrators through professional development, and increasing the knowledge infrastructure to support CT opportunities for students. One challenge that districts face when scaling new initiatives occurs when the work becomes siloed to one ''champion'' teacher or a singular motivated department. This poster presents Broward County Public Schools' use of an interactive infographic to build awareness of their CT initiative, including considerations for utilizing an infographic tool and the design decisions made to engage various stakeholders. The poster provides examples of methods to build knowledge of an emerging initiative and adds to the growing body of work in supporting districts as they scale their CS/CT initiatives."
"Cartoonimator: A Low-cost, Paper-based Animation Kit for Computational Thinking","Ranjan, Krithik and Gyory, Peter and Rivera, Michael L and Do, Ellen Yi-Luen",2023,"Computational thinking has been identified as an important skill for children to learn in the 21st century, and many innovative kits and tools have been developed to integrate it into children’s learning. Yet, most solutions require the use of devices like computers or other expensive hardware, thus being inaccessible to low-income schools and communities. We present Cartoonimator, a low-cost, paper-based computational kit for children to create animations and engage with computational thinking. Cartoonimator requires only paper and a smartphone to use, offering an affordable learning experience. Children can draw the scenes and characters for their animation on the paper, which is printed with computer vision markers. We developed the mobile web app to provide an interface to capture keyframes and compile them into animations. In this paper, we describe the implementation and workflow of Cartoonimator, its deployment with children at a local STEAM event, and a planned evaluation for the kit."
"Champion, Collaborator, Curator, Anchor: Supporting K-12 Teachers to Integrate Computational Thinking","Coenraad, Merijke and Rangel, Alessandra and Burke, Quinn and Mills, Kelly and Ruiz, Pati and Dunbar, Kyle",2024,"Computational thinking (CT) provides opportunities for students to build the skills they need for everyday life, future academic success, and careers. Increasingly, districts are integrating CT into K-12 disciplinary subjects and a growing number of teachers need the knowledge to lead CT learning opportunities. CT is still nascent in teacher education, however, and not all teachers are receiving professional learning on the job. Teachers need effective methods of support to ensure they are providing students with high quality CT learning opportunities. We present methods of support for integrating CT into schools. The poster highlights four methods to support teacher professional learning: allowing ample time for collaboration, a school-based advocate championing CT integration, posting and promoting curated resources, and a foundational person anchoring the work as the initiative expands. In doing so, this poster provides interrelated examples of teacher support and highlights methods of continuous support for teachers integrating CT across content areas."
Collaborative Approaches for Effective and Sustainable Integration of Computational Thinking Educational Strategies,"Paludo, Giulia and Montresor, Alberto",2024,Sin Valor
Computational Thinking 2.0,"Tedre, Matti",2022,"Machine learning (ML) has triggered major changes across a great number of computing fields. People’s lives today are full of ML-driven services: eerily accurate recommendations, ability to automatically tag one’s friends in photos, and well working translation systems, for example. This keynote talk presents how ML technology upends the computational thinking (CT) consensus in computing education. It begins by presenting why and how a number of classical “CT1.0” concepts need to be re-thought for the “CT2.0” (machine learning) era, from control structures and problem-solving workflow, to correctness and notional machines. Based on a series of classroom interventions on teaching machine learning to middle schoolers, conducted by DIGS RC at University of Eastern Finland, the talk also presents how classroom pedagogy shifts between CT1.0 and CT2.0."
Computational Thinking and Attitudes Towards Computing: An Emerging Relationship in Elementary Students,"Ojeda-Ramirez, Santiago and Parker, Miranda C. and Garcia, Leiny and Tate, Tamara and Villa, Jillian Rae and Warschauer, Mark",2023,"This study analyzed the relationship between computational thinking (CT) and coding attitudes of upper elementary students after exposure to a year-long CT curriculum. Using ordinary least squares regression and controlling for student demographics (i.e., gender and English Learner (EL) status), we found that CT skills were a significant factor in modeling coding attitudes, regardless of demographic controls. Interviews of the students unveiled an interaction between coding interest and social values in a debugging process."
Computational Thinking and Notional Machines: The Missing Link,"Munasinghe, Bhagya and Bell, Tim and Robins, Anthony",2023,"In learning to program and understanding how a programming language controls a computer, learners develop both insights and misconceptions whilst their mental models are gradually refined. It is important that the learner is able to distinguish the different elements and roles of a computer (compiler, interpreter, memory, etc.), which novice programmers may find difficult to comprehend. Forming accurate mental models is one of the potential sources of difficulty inextricably linked to mastering computing concepts and processes, and for learning computer programming.It is common to use some form of representation (e.g., an abstract machine or a Computational Agent (CA)) to support technical or pedagogic explanations. The Notional Machine (NM) is a pedagogical device that entails one or more computational concepts, originally described as an idealised computer operating with the constructs of a particular programming language. It can be used to support specific or general learning goals and will typically have some concrete representation that can be referred to. Computational Thinking (CT), which is defined as a way of thinking that is used for [computational] problem solving, is often presented as using a CA to carry out information processing presented by a solution.In CT, where the typical goal is to produce an algorithm or a computer program, the CA seemingly serves a purpose very similar to an NM. Although it changes through the different stages of development (of the learner and of the curriculum), the roles of CAs and NMs can be seen as versatile tools that connect a learner’s mental model with the conceptual model of a program. In this article, we look at this relationship between CAs and NMs, and indicate how they would look at different stages of learning. We traverse the range of definitions and usages of these concepts, and articulate models that clarify how these are viewed in the literature. This includes exploring the nature of machines and agents, and how historical views of these relate to modern pedagogy for computation. We argue that the CA can be seen as an abstract, simplified variant of an NM that provides a useful perspective to the learner to support them to form robust mental models of NMs more efficiently and effectively. We propose that teaching programming should make use of the idea of a CA at different stages of learning, as a link that connects a learner’s mental model to a full NM."
Computational Thinking Assessment Tools: A Systematic Review of the Literature (Initial Findings).,"Sheridan, Frances and Stynes, Paul and Pathak, Pramod and Quille, Keith",2024,"Since Jeanette Wing’s influential 2006 article, research into developing Computational Thinking (CT) skills has surged. Despite ongoing debates about CT definitions and components, reliable and valid assessment tools are crucial for measuring CT skill impact and evaluating related interventions. This systematic literature review seeks to identify CT assessment tools suitable for undergraduate computing students, by investigating the central question ""What tools are available for the assessment of CT skills?"". A comprehensive search of academic databases for CT assessment publications since 2006 yielded 202 unique articles. After applying exclusion criteria, 72 relevant articles were analyzed. The selected publications were categorized by tool type, and focus, examining tool reliability and validity. This paper presents initial findings from this review."
Computational thinking for professionals,"Denning, Peter J. and Tedre, Matti",2021,Professionals practice a form of computational thinking that is significantly more advanced than popular descriptions suggest.
